{
  "schema_version": 1,
  "audience": "Clinical researchers and evidence-review methodologists",
  "tldr": [
    "The primary pooled estimate favors the intervention, with moderate certainty.",
    "Between-study heterogeneity limits generalization to underrepresented populations."
  ],
  "section_order": [
    "question",
    "tldr",
    "evidence",
    "results",
    "limitations",
    "methods",
    "provenance",
    "references"
  ],
  "labels": {
    "overall_response": "Overall response",
    "serious_adverse_events": "Serious adverse events",
    "results": "Quantitative results"
  },
  "figure_inventory": [
    {
      "id": "forest-overall-response",
      "label": "Overall response forest plot",
      "source_artifacts": [
        "analysis.json",
        "effects.json"
      ],
      "visible": true
    }
  ],
  "visibility": {
    "question": true,
    "tldr": true,
    "methods": true,
    "provenance": true
  },
  "provenance_notes": [
    "Every study estimate links to the exact Paperclip source lines.",
    "The report reflects the managed execution recorded for this results revision."
  ]
}
